{
  "id": "casa-forte",
  "tipo": "compra",
  "bairro": "Casa Forte",
  "fase": "prototipo",
  "gerado_em": "2026-10-15",
  "endereco": {
    "logradouro": "Endereço ilustrativo",
    "numero": null,
    "ilustrativo": true
  },
  "lote": {
    "dsqfl": null,
    "confirmado": true,
    "centro": [
      -34.9195,
      -8.0352
    ],
    "poligono": null,
    "ilustrativo_poligono": true
  },
  "anuncio": {
    "lido_em": "2026-10-15",
    "observacao": "dossiê fictício",
    "campos": {
      "preco": {
        "id": "anuncio_preco",
        "rotulo": "declarado",
        "valor": 1180000,
        "unidade": "R$",
        "texto": "R$ 1.180.000",
        "fonte": {
          "base": "dado ilustrativo, pendente de fonte",
          "orgao": null,
          "licenca": null,
          "url": null,
          "atualizado_em": null,
          "consultado_em": null,
          "via": null
        },
        "escala": null,
        "ilustrativo": true,
        "estado": "padrao",
        "motivo_nao_sabemos": null
      },
      "condominio": {
        "id": "anuncio_condominio",
        "rotulo": "declarado",
        "valor": 1450,
        "unidade": "R$/mês",
        "texto": "R$ 1.450/mês",
        "fonte": {
          "base": "dado ilustrativo, pendente de fonte",
          "orgao": null,
          "licenca": null,
          "url": null,
          "atualizado_em": null,
          "consultado_em": null,
          "via": null
        },
        "escala": null,
        "ilustrativo": true,
        "estado": "padrao",
        "motivo_nao_sabemos": null
      },
      "area": {
        "id": "anuncio_area",
        "rotulo": "declarado",
        "valor": 160,
        "unidade": "m²",
        "texto": "160 m²",
        "fonte": {
          "base": "dado ilustrativo, pendente de fonte",
          "orgao": null,
          "licenca": null,
          "url": null,
          "atualizado_em": null,
          "consultado_em": null,
          "via": null
        },
        "escala": null,
        "ilustrativo": true,
        "estado": "padrao",
        "motivo_nao_sabemos": null
      },
      "quartos": {
        "id": "anuncio_quartos",
        "rotulo": "declarado",
        "valor": 4,
        "unidade": null,
        "texto": "4",
        "fonte": {
          "base": "dado ilustrativo, pendente de fonte",
          "orgao": null,
          "licenca": null,
          "url": null,
          "atualizado_em": null,
          "consultado_em": null,
          "via": null
        },
        "escala": null,
        "ilustrativo": true,
        "estado": "padrao",
        "motivo_nao_sabemos": null
      },
      "banheiros": {
        "id": "anuncio_banheiros",
        "rotulo": "declarado",
        "valor": 4,
        "unidade": null,
        "texto": "4",
        "fonte": {
          "base": "dado ilustrativo, pendente de fonte",
          "orgao": null,
          "licenca": null,
          "url": null,
          "atualizado_em": null,
          "consultado_em": null,
          "via": null
        },
        "escala": null,
        "ilustrativo": true,
        "estado": "padrao",
        "motivo_nao_sabemos": null
      },
      "vagas": {
        "id": "anuncio_vagas",
        "rotulo": "declarado",
        "valor": 3,
        "unidade": null,
        "texto": "3",
        "fonte": {
          "base": "dado ilustrativo, pendente de fonte",
          "orgao": null,
          "licenca": null,
          "url": null,
          "atualizado_em": null,
          "consultado_em": null,
          "via": null
        },
        "escala": null,
        "ilustrativo": true,
        "estado": "padrao",
        "motivo_nao_sabemos": null
      },
      "andar": {
        "id": "anuncio_andar",
        "rotulo": "declarado",
        "valor": 9,
        "unidade": null,
        "texto": "9º andar",
        "fonte": {
          "base": "dado ilustrativo, pendente de fonte",
          "orgao": null,
          "licenca": null,
          "url": null,
          "atualizado_em": null,
          "consultado_em": null,
          "via": null
        },
        "escala": null,
        "ilustrativo": true,
        "estado": "padrao",
        "motivo_nao_sabemos": null
      }
    }
  },
  "preco": {
    "valor_m2": 7375,
    "regua": {
      "universo": "avaliações fiscais de apartamentos",
      "recorte": "bairro",
      "periodo_meses": 12,
      "n": 137,
      "p25": 4001,
      "mediana": 5124,
      "p75": 6691,
      "minimo": 2394,
      "maximo": 8713,
      "valor_anuncio": 7375,
      "posicao_percentil": 80,
      "unidade": "R$/m²",
      "rotulo": "registro_oficial",
      "fonte": {
        "base": "ITBI 2015-2026",
        "orgao": "Prefeitura do Recife",
        "licenca": "ODbL",
        "url": "https://dados.recife.pe.gov.br/dataset/imposto-sobre-transmissao-de-bens-imoveis-itbi",
        "atualizado_em": null,
        "consultado_em": "2026-10-15",
        "via": null
      },
      "escala": "quartis do ITBI, Casa Forte, 12 meses, N = 137",
      "ilustrativo": false,
      "frase": "Acima de 80% das avaliações fiscais de apartamentos no bairro."
    }
  },
  "visita": [
    {
      "texto": "O anúncio não diz o valor do IPTU.",
      "origem": []
    },
    {
      "texto": "Suscetibilidade: não sabemos.",
      "origem": [],
      "escala": "SGB 2015, sem setorização no Recife",
      "rotulo": "nao_sabemos"
    }
  ],
  "secoes": [
    {
      "id": "predio",
      "titulo": "O prédio",
      "fase": "prototipo",
      "bloco_prd": "cadastro",
      "icone": "building",
      "resumo": "18 pavimentos, construído em 2012",
      "fatos": [
        {
          "id": "pavimentos",
          "rotulo": "registro_oficial",
          "valor": 18,
          "unidade": null,
          "texto": "18",
          "fonte": {
            "base": "dado ilustrativo, pendente de fonte",
            "orgao": null,
            "licenca": null,
            "url": null,
            "atualizado_em": null,
            "consultado_em": null,
            "via": null
          },
          "escala": null,
          "ilustrativo": true,
          "estado": "padrao",
          "motivo_nao_sabemos": null
        },
        {
          "id": "ano",
          "rotulo": "registro_oficial",
          "valor": 2012,
          "unidade": null,
          "texto": "2012",
          "fonte": {
            "base": "dado ilustrativo, pendente de fonte",
            "orgao": null,
            "licenca": null,
            "url": null,
            "atualizado_em": null,
            "consultado_em": null,
            "via": null
          },
          "escala": null,
          "ilustrativo": true,
          "estado": "padrao",
          "motivo_nao_sabemos": null
        }
      ],
      "grafico": null,
      "ilustrativo": true
    },
    {
      "id": "transmissoes",
      "titulo": "Transmissões no prédio",
      "fase": "prototipo",
      "bloco_prd": "fiscal",
      "icone": "arrows-exchange",
      "resumo": "31 avaliações fiscais desde 2015",
      "fatos": [
        {
          "id": "transmissoes_total",
          "rotulo": "registro_oficial",
          "valor": 31,
          "unidade": null,
          "texto": "31",
          "fonte": {
            "base": "dado ilustrativo, pendente de fonte",
            "orgao": null,
            "licenca": null,
            "url": null,
            "atualizado_em": null,
            "consultado_em": null,
            "via": null
          },
          "escala": "avaliação fiscal do ITBI, não preço; agregado do edifício, 2015-2026",
          "ilustrativo": true,
          "estado": "padrao",
          "motivo_nao_sabemos": null
        }
      ],
      "grafico": null,
      "ilustrativo": true
    },
    {
      "id": "obras",
      "titulo": "Obras próximas",
      "fase": "prototipo",
      "bloco_prd": "cadastro",
      "icone": "crane",
      "resumo": "2 processos em 150 m desde 2017",
      "fatos": [
        {
          "id": "obras_total",
          "rotulo": "registro_oficial",
          "valor": 2,
          "unidade": null,
          "texto": "2",
          "fonte": {
            "base": "dado ilustrativo, pendente de fonte",
            "orgao": null,
            "licenca": null,
            "url": null,
            "atualizado_em": null,
            "consultado_em": null,
            "via": null
          },
          "escala": "licenciamento em 150 m, só processos digitais desde 2017; ausência não é irregularidade",
          "ilustrativo": true,
          "estado": "padrao",
          "motivo_nao_sabemos": null
        }
      ],
      "grafico": null,
      "ilustrativo": true
    },
    {
      "id": "defesa_civil",
      "titulo": "Defesa Civil no bairro",
      "fase": "prototipo",
      "bloco_prd": "defesa_civil",
      "icone": "home-shield",
      "resumo": "26 atendimentos em 2024",
      "fatos": [
        {
          "id": "dc_total",
          "rotulo": "registro_oficial",
          "valor": 26,
          "unidade": "atendimentos",
          "texto": "26",
          "fonte": {
            "base": "Registro de atendimentos da Defesa Civil 2024",
            "orgao": "Prefeitura do Recife",
            "licenca": "ODbL",
            "url": "https://dados.recife.pe.gov.br/dataset/registro-de-atendimentos-da-defesa-civil",
            "atualizado_em": "2026-03-04",
            "consultado_em": "2026-10-15",
            "via": null
          },
          "escala": "atendimentos registrados pela Defesa Civil, 2024, por bairro; sem registro não significa sem risco",
          "ilustrativo": false,
          "estado": "padrao",
          "motivo_nao_sabemos": null
        }
      ],
      "grafico": {
        "tipo": "anel",
        "rotulo_centro": "atendimentos",
        "total": 26,
        "fatias": [
          {
            "nome": "Encaminhamentos aos parceiros",
            "valor": 11,
            "cor": "cat-ipe-amarelo"
          },
          {
            "nome": "Análise visual estrutural",